{
  "checked_artifacts": {
    "contract_hash": "sha256:9e47696e2ae29b42daed381d1217adf59885fb4110806039b3286070e847f011",
    "input_hash": "sha256:2ff966b52a5cc29e62e51d54bbe95fab579e39d5c13b5971d37952c109e2c119",
    "policy_hash": "sha256:b533039aa375f790fbd74e42fc6f2965c52c47ea61fa42f286b9d44f21ff3df3",
    "receipt_hash": "sha256:637679def1511eda6c5dd26e90caa247689cd5524f39bb8947ea9afad2b7ac39"
  },
  "checked_fields": [
    "status",
    "rule_version",
    "input_hash",
    "contract_hash",
    "policy_hash",
    "contract_id",
    "policy_id",
    "evaluated_fields",
    "computed_value",
    "threshold",
    "output_hash",
    "evaluator"
  ],
  "contract_id": "bell-state-correlation-contract",
  "mismatches": [
    "status: expected 'PASS', found 'FAIL'",
    "output_hash: expected 'sha256:37331b1f094dfae5198c5dbce4078f03e68c66cf169602b3569ec69f16064820', found 'sha256:789698136ecd7f64778d87734151380da8ebd44c558aa9ba8ce8ae25aafe0e1d'"
  ],
  "notes": [],
  "policy_id": "basic-deterministic-policy",
  "receipt_id": "receipt-bell-state-output-pass-001-tampered-status",
  "recomputed_decision": "PASS",
  "report_hash": "sha256:d35b111ace32644e27542a081e56cc25bdf0f2ca7e7de24191892314ca5085e0",
  "timestamp": "2026-05-13T00:00:00Z",
  "verification_id": "verification-receipt-bell-state-output-pass-001-tampered-status",
  "verification_status": "INVALID_RECEIPT",
  "verifier": "reference-receipt-verifier"
}
