{
  "checked_artifacts": {
    "contract_hash": "sha256:9e47696e2ae29b42daed381d1217adf59885fb4110806039b3286070e847f011",
    "input_hash": "sha256:2ff966b52a5cc29e62e51d54bbe95fab579e39d5c13b5971d37952c109e2c119",
    "policy_hash": "sha256:b533039aa375f790fbd74e42fc6f2965c52c47ea61fa42f286b9d44f21ff3df3",
    "receipt_hash": "sha256:f673898f4ef1050affd80f88bf70b63c6c6b873fea44edd3ed7c5f9e8949bb7d"
  },
  "checked_fields": [
    "status",
    "rule_version",
    "input_hash",
    "contract_hash",
    "policy_hash",
    "contract_id",
    "policy_id",
    "evaluated_fields",
    "computed_value",
    "threshold",
    "output_hash",
    "evaluator"
  ],
  "contract_id": "bell-state-correlation-contract",
  "mismatches": [],
  "notes": [],
  "policy_id": "basic-deterministic-policy",
  "receipt_id": "receipt-bell-state-output-pass-001",
  "recomputed_decision": "PASS",
  "report_hash": "sha256:e99f7d4f1784e1de1a7d6468f0aca1adeb77c739ec8955821b989d569b35f6d0",
  "timestamp": "2026-05-13T00:00:00Z",
  "verification_id": "verification-receipt-bell-state-output-pass-001",
  "verification_status": "VALID_RECEIPT",
  "verifier": "reference-receipt-verifier"
}
